{
  "schema_ref": "../../schemas/workstream-state.schema.json",
  "schema_version": 1,
  "workstream_id": "model-runtime",
  "current_milestone": "Model Runtime / Model Store Foundation",
  "current_checkpoint": "host-manifest-registry-store-and-provider-contract",
  "status": "PARTIAL",
  "last_verified": {
    "commit_sha": "ba0b1b0864c6583663ab9118b256c6f250935380",
    "verified_at": "2026-09-26T07:25:43Z",
    "normal_state": "Integrated codex/ws-model-runtime commit 21dbe1e4a3277fa336e73616018994e80847caa7 as a user-space no_std model metadata/registry/Store/provider-contract foundation. Current integration-tree checks pass: 25 unit tests, 2 manifest/schema contract tests, formatting, Clippy with warnings denied, and a Nagi x86_64 user-target library compile. The CRLF-sensitive malformed-manifest test failure from Windows CI was reproduced locally, fixed by removing the field without depending on line endings, and the regression test now passes. Model fixtures are illustrative and contain no distributable weights or source/hash claims; the runtime uses only a test-support fake backend in tests. No model download, host AI service, real inference backend, or runtime app/kernel hook is integrated. Source docs keep M20 NOT STARTED; prior milestones M17-M19 remain incomplete.",
    "commands": [
      "cargo fmt --manifest-path user/nagi-model-manager/Cargo.toml -- --check",
      "cargo test --locked -p nagi-model-manager",
      "cargo clippy --locked -p nagi-model-manager --all-targets -- -D warnings",
      "__CARGO_TESTS_ONLY_SRC_ROOT=./out/rust-src/library cargo check -p nagi-model-manager --target targets/x86_64-unknown-nagi-user.json --lib --locked --offline -Zbuild-std=std,panic_abort",
      "cargo test -p nagi-model-manager --locked rejects_unknown_fields_and_malformed_json",
      "./nagi dev verify",
      "git diff --check; git diff --cached --check"
    ],
    "tests": [
      {
        "name": "Model Runtime host tests",
        "command": "cargo test --locked -p nagi-model-manager",
        "outcome": "PASS",
        "exit_code": 0,
        "evidence": "All 25 unit tests and 2 manifest/schema contract tests passed; doc-tests contain 0 tests."
      },
      {
        "name": "Model Runtime formatting and Clippy",
        "command": "cargo fmt --manifest-path user/nagi-model-manager/Cargo.toml -- --check; cargo clippy --locked -p nagi-model-manager --all-targets -- -D warnings",
        "outcome": "PASS",
        "exit_code": 0,
        "evidence": "Package formatting passed and Clippy passed with warnings denied."
      },
      {
        "name": "Model Runtime Nagi user-target compile",
        "command": "__CARGO_TESTS_ONLY_SRC_ROOT=./out/rust-src/library cargo check -p nagi-model-manager --target targets/x86_64-unknown-nagi-user.json --lib --locked --offline -Zbuild-std=std,panic_abort",
        "outcome": "PASS",
        "exit_code": 0,
        "evidence": "The no_std model manager library compiles for Nagi x86_64 user target; this does not execute inference or prove M20 acceptance."
      },
      {
        "name": "CRLF malformed-manifest regression before fix",
        "command": "cargo test -p nagi-model-manager --locked rejects_unknown_fields_and_malformed_json",
        "outcome": "FAIL",
        "exit_code": 101,
        "evidence": "With CRLF fixture bytes and the old newline-sensitive replacement, the supposedly malformed manifest retained its `source` field and parsed successfully. This reproduced the Windows CI failure."
      },
      {
        "name": "CRLF malformed-manifest regression after fix",
        "command": "cargo test -p nagi-model-manager --locked rejects_unknown_fields_and_malformed_json",
        "outcome": "PASS",
        "exit_code": 0,
        "evidence": "The test now constructs normalized CRLF input and removes the required `source` field by content; the parser rejects the missing field as malformed JSON."
      },
      {
        "name": "Source branch GitHub Actions",
        "command": "gh run view 36215549131 --repo RT-NISH/NagiOS",
        "outcome": "FAIL",
        "exit_code": 1,
        "evidence": "Ubuntu host checks passed. Windows host tests failed the newline-sensitive malformed-manifest test, now fixed on this integration branch. The target job separately failed at the independent M17 first-web-pixel acceptance after target builds passed through UEFI."
      },
      {
        "name": "Model Runtime durable state registration",
        "command": "./nagi dev verify",
        "outcome": "PASS",
        "exit_code": 0,
        "evidence": "15 registered workstreams and 7 state files validated on codex/integration-next-phase."
      },
      {
        "name": "Model Runtime integration whitespace",
        "command": "git diff --check; git diff --cached --check",
        "outcome": "PASS",
        "exit_code": 0,
        "evidence": "No whitespace errors."
      }
    ],
    "ci_runs": [
      {
        "run_id": 36215549131,
        "url": "https://github.com/RT-NISH/NagiOS/actions/runs/36215549131",
        "head_sha": "21dbe1e4a3277fa336e73616018994e80847caa7",
        "status": "COMPLETED",
        "conclusion": "FAILURE",
        "summary": "Ubuntu host job passed. Windows host tests failed only the line-ending-sensitive malformed-manifest fixture; M17 target acceptance failed independently after target builds reached UEFI. The Windows regression is fixed in this integration branch."
      }
    ]
  },
  "release_line_gate": {
    "source": "docs/workstreams/model-runtime.md and docs/implementation_status.md",
    "last_checked_at": "2026-09-26T07:25:43Z",
    "activation_requirement": "This is a host-side foundation and target compile only. Nagi 0.1 M20 remains NOT STARTED until M17-M19 are completed in order and a real local Granite response is accepted; any 0.2 product/runtime activation also requires M30 PASS and an explicit integration checkpoint."
  },
  "blocker": {
    "active": false,
    "class": null,
    "summary": null,
    "reproduction_commands": [],
    "failure_log_summary": null,
    "attempted_fixes": [
      "Reproduced the Windows-only fixture mutation failure with explicit CRLF input and removed the source field by content rather than an LF-sensitive suffix."
    ],
    "do_not_try": [
      "Do not treat test-support fake providers as real inference.",
      "Do not add host filesystem access, model downloads, or a host AI daemon.",
      "Do not mark M20 complete without a real local Granite response inside Nagi.",
      "Do not activate a production model runtime before the milestone and release gates."
    ]
  },
  "next_action": "Keep M20 NOT STARTED while M17-M19 remain incomplete. At the proper milestone, verify the pinned Granite 4.2 3B artifact source/hash/license metadata and real in-guest inference acceptance; do not infer this from current host or target-compilation checks.",
  "acceptance_criteria": [
    "Strict model manifest v1 parsing rejects unknown fields, malformed identifiers, unsupported versions, invalid resource bounds, and malformed integrity metadata.",
    "Registry selection filters by capability, role, architecture, available resources, context, and offline constraints with deterministic user-preference/default/fallback ordering.",
    "Model Store metadata models install/update/removal lifecycle, integrity checks, license acknowledgement, NOTICE records, and prior-version preservation on failed updates.",
    "Provider/runtime APIs are capability-neutral and expose bounded model reads, request limits, cancellation/deadline inputs, and structured errors.",
    "Granite, Qwen, and Gemma fixtures are explicitly illustrative and contain no downloadable weights or false hash/license claims.",
    "Host tests, formatting, Clippy, schema contract tests, and Nagi user-target library compilation pass.",
    "No production inference backend, model weights, host downloader/service, or kernel/runtime hook is included.",
    "M20 remains NOT STARTED until M17-M19 finish in order and a real local Granite response is accepted."
  ],
  "deferred": [
    "Pinned distributable IBM Granite 4.2 3B revision, source URL, exact filename, size, SHA-256, provider license, and NOTICE validation.",
    "Production llama.cpp/GGUF backend and real local inference inside Nagi.",
    "Target runtime activation, final archive linking and in-guest inference.",
    "Source/hash/license profile updates and model installation/update integration.",
    "M20 acceptance until prerequisite milestones and its real-response criterion pass."
  ],
  "cross_workstream_dependencies": [
    {
      "workstream_id": "development-foundation",
      "contract": "DF-01 registry and durable state contract.",
      "version": "nagi-dev-v1",
      "status": "PASS"
    },
    {
      "workstream_id": "localization-i18n",
      "contract": "No runtime dependency; model identity and provider metadata remain independent of display localization.",
      "version": "localization-contract-v1",
      "status": "INDEPENDENT / NO API DEPENDENCY"
    }
  ]
}
